{"api_url":"http://127.0.0.1:8765/api/v0.5/workbench","contained_record_count":0,"record_count":1,"runtime":{"package_version":"0.5.0","provenance_id":"a5a630105bd473d947a5dc988b6b75e30dbf0cca5b666a014e9a002d9bcb9f93"},"schema_version":"tcw.workbench-startup/v0.5","session_id":"e134ab4b7be33a82ad139a9745f0c63cff3dd6ab30c914938fab9ecba38c797c","status":"READY","top_level_record_count":1,"url":"http://127.0.0.1:8765/"}
